Model,Year,Price,Body,Storage,Display,Camera,Battery,Colours
Huawei Honor 8X,Exp. release 2018  September,About 220 EUR,175g  7.8mm thickness,64/128GB storage  microSD card slot   6,6.5",20 MP  f/1 8  PDAF,3750,Black  Blue  Red  Pink
Huawei Honor 8X Max,Exp. release 2018  September,About 250 EUR,210g  8.1mm thickness,64/128GB storage  microSD card slot   6,7.12",16 MP  f/2.0  PDAF,5000,Black  Blue  Red
Huawei Mate 20 Lite,Exp. release 2018  September,About 400 EUR,172g  7.6mm thickness,64GB storage  microSD card slot   6,6.3",20 MP  f/1.8  PDAF,3750,Sapphire Blue  Black  Platinum gold
Huawei Honor Note 10,Released 2018  August,About 400 EUR,230g  7.7mm thickness,128GB storage  microSD card slot   8,6.95",16 MP  f/1.8  PDAF,5000,Midnight Black  Phantom Blue
Huawei Honor 9N (9i),Released 2018  July,About 220 EUR,152g  7.7mm thickness,64/128GB storage  microSD card slot   4,5.84",13 MP  PDAF,3000,Lavender Purple  Robin Egg Blue  Sapphire Blue  Midnight Black
Huawei P Smart+ (nova 3i),Released 2018  August,About 350 EUR,169g  7.6mm thickness,128GB storage  microSD card slot   6,6.3",16 MP  f/2.2  PDAF,3340,Black  Pearl White  Iris Purple
Huawei nova 3,Released 2018  August,About 450 EUR,166g  7.3mm thickness,128GB storage  microSD card slot   6,6.3",16 MP  27mm  f/1.8  PDAF,3750,Iris Purple  Airy blue  Primrose Gold  Red  Black
Huawei Honor Play,Released 2018  August,About 320 EUR,176g  7.5mm thickness,64GB storage  microSD card slot   6,6.3",16  f/2.2  PDAF,3750,Midnight Black  Navy Blue  Violet  Player Edition Red  Player Edition Black
Huawei Watch 2 2018,Released 2018  May,About 270 EUR,57g  12.6mm thickness,4GB storage  no card slot   768,1.2",No,420,Dynamic Orange  Carbon Black  Concrete Grey
Huawei Honor 7s,Released 2018  May,About 110 EUR,142g  8.3mm thickness,16GB storage  microSD card slot   2,5.45",13 MP  PDAF,3020,Black  Gold  Blue
Huawei Y5 Prime (2018),Released 2018  June,About 100 EUR,142g  8.3mm thickness,16GB storage  microSD card slot   2,5.45",13 MP  f/2.0  AF,3020,Black  Gold  Blue
Huawei Y3 (2018),Released 2018  May,About 90 EUR,175g  9.5mm thickness,8GB storage  microSD card slot   1,5.0",8 MP  AF  f/2.0,2280,Gold  White  Gray
Huawei Honor 10,Released 2018  May,About 400 EUR,153g  7.7mm thickness,64/128GB storage  no card slot   8,5.84",16 MP  f/1.8  PDAF,3400,Phantom Blue  Phantom Green  Midnight Black  Glacier Grey  Lily White (GT version only)
Huawei Y6 (2018),Released 2018  May,About 150 EUR,150g  7.8mm thickness,16GB storage  microSD card slot   2,5.7",13 MP  PDAF,3000,Black  Gold  Blue
Huawei Mate RS Porsche Design,Released 2018  April,About 1600 EUR,183g  8.5mm thickness,256/512GB storage  no card slot   6,6.0",40 MP  f/1.8  27mm  1/1.7"  OIS  PDAF/Laser AF,4000,Black  Red
Huawei P20 Pro,Released 2018  April,About 790 EUR,180g  7.8mm thickness,256GB storage  no card slot   8,6.1",40 MP  f/1.8  27mm  1/1.7"  OIS  PDAF/Laser AF,4000,Twilight  Black  Midnight Blue  Pink Gold
Huawei P20,Released 2018  April,About 680 EUR,165g  7.7mm thickness,128GB storage  no card slot   4,5.8",12 MP  f/1.8  27mm  1/2.3"  1.55µm  OIS  PDAF & laser AF,3400,Twilight  Black  Midnight Blue  Pink Gold
Huawei P20 lite,Released 2018  March,About 280 EUR,145g  7.4mm thickness,32/64GB storage  microSD card slot   4,5.84",16 MP  f/2.2  1.0µm  PDAF,3000,Klein Blue  Sakura Pink  Midnight Black
Huawei Honor 7A,Released 2018  April,About 120 EUR,150g  7.8mm thickness,32GB storage  microSD card slot   3,5.7",13 MP  f/2.2  PDAF,3000,Black  Gold  Blue
Huawei Y7 Pro (2018),Released 2018  April,About 150 EUR,155g  7.8mm thickness,32GB storage  microSD card slot   3,5.99",13 MP  PDAF,3000,Black  Gold  Blue
Huawei Y7 Prime (2018),Released 2018  April,About 170 EUR,155g  7.8mm thickness,32GB storage  microSD card slot   3,5.99",13 MP  f/2.2  PDAF,3000,Black  Gold  Blue
Huawei Y7 (2018),Released 2018  April,About 150 EUR,155g  7.8mm thickness,16GB storage  microSD card slot   2,5.99",13 MP  PDAF  f/2.2,3000,Black  Gold  Blue
Huawei Y9 (2018),Released 2018  April,About 220 EUR,170g  7.9mm thickness,64/128GB storage  microSD card slot   4,5.93",16 MP  f/2.2  27mm  PDAF,4000,Black  Gold  Blue
Huawei Honor 7C,Released 2018  May,About 200 EUR,164g  7.8mm thickness,32/64GB storage  microSD card slot   4,5.99",13 MP  f/2.2  PDAF,3000,Black  Red  Gold  Blue
Huawei MediaPad M5 10 (Pro),Released 2018  April,About 500 EUR,498g  7.3mm thickness,64/128GB storage  microSD card slot   4,10.8",13 MP  PDAF,7500,Space Gray  Champagne Gold
Huawei MediaPad M5 10,Released 2018  April,About 380 EUR,498g  7.3mm thickness,32/64/128GB storage  microSD card slot   4,10.8",13 MP  PDAF,7500,Space Gray  Champagne Gold
Huawei MediaPad M5 8,Released 2018  April,About 330 EUR,316g  7.3mm thickness,32/64/128GB storage  microSD card slot   4,8.4",13 MP  PDAF,5100,Space Gray  Champagne Gold
Huawei Honor 9 Lite,Released 2017  December,About 190 EUR,149g  7.6mm thickness,64GB storage  microSD card slot   4,5.65",13 MP  PDAF,3000,Midnight Black  Sapphire Blue  Glacier Gray  Navy  Seagull Gray  Magic Nightfall  Pearl White
Huawei P smart,Released 2017  December,About 260 EUR,143g  7.5mm thickness,64GB storage  microSD card slot   4,5.65",13 MP  AF,3000,Black  Blue  Gold  Rose Gold
Huawei nova 2s,Released 2017  December,About 400 EUR,169g  7.5mm thickness,128GB storage  microSD card slot   6,6.0",16 MP  f/1.8  PDAF,3340,Black  Gray  Red  Rose Gold  Light Blue
Huawei Honor 7X,Released 2017  December,About 290 EUR,165g  7.6mm thickness,64GB storage  microSD card slot   4,5.93",16 MP  f/2.2  26mm  1/2.9"  1.25µm  PDAF,3340,Black  Blue  Gold  Red  Gray
Huawei Honor View 10,Released 2018  January,About 400 EUR,172g  7mm thickness,128GB storage  microSD card slot   6,5.99",16 MP  f/1.8  PDAF,3750,Navy Blue  Midnight Black  Beach Gold  Aurora Blue  Charm Red
Huawei Mate 10 Porsche Design,Released 2017  November,About 1400 EUR,178g  7.9mm thickness,256GB storage  no card slot   6,6.0",12 MP  f/1.6  27mm  1/2.9"  1.25µm  OIS  PDAF & laser AF,4000,Diamond Black
Huawei Mate 10 Pro,Released 2017  November,About 500 EUR,178g  7.9mm thickness,128GB storage  no card slot   6,6.0",12 MP  f/1.6  27mm  1/2.9"  1.25µm  OIS  PDAF & laser AF,4000,Midnight Blue  Titanium Gray  Mocha Brown  Pink Gold
Huawei Mate 10,Released 2017  November,About 590 EUR,186g  8.2mm thickness,64GB storage  microSD card slot   4,5.9",12 MP  f/1.6  27mm  1/2.9"  1.25µm  OIS  PDAF & laser AF,4000,Mocha Brown  Black  Champagne Gold  Pink Gold
Huawei Watch 2 Pro,Released 2017  November,About 330 EUR,64g  12.6mm thickness,4GB storage  no card slot   768,1.2",No,420,Titanium Grey
Huawei Honor 6C Pro,Released 2017  November,About 180 EUR,145g  7.7mm thickness,32GB storage  microSD card slot   3,5.2",13 MP  PDAF  f/2.2,3000,Black  Blue  Gold
Huawei Mate 10 Lite,Released 2017  November,About 230 EUR,164g  7.5mm thickness,64GB storage  microSD card slot   4,5.9",16 MP  f/2.2  27mm  PDAF,3340,Graphite Black  Prestige Gold  Aurora Blue
Huawei P9 lite mini,Released 2017  September,About 150 EUR,145g  8.1mm thickness,16GB storage  microSD card slot   2,5.0",13 MP  AF,3020,Silver  black  gold
Huawei Honor 9,Released 2017  July,About 320 EUR,155g  7.5mm thickness,64/128GB storage  microSD card slot   6,5.15",12 MP  f/2.2  27mm  PDAF  2x lossless zoom,3200,Glacier Grey  Sapphire Blue  Midnight Black  Gold  Blue Bird  Robin Egg Blue
